{
  "$schema": "https://json-schema.org/draft/2020-12/schema",
  "$id": "https://portfolio-harness.local/profiles/profile.schema.json",
  "type": "object",
  "required": [
    "schemaVersion",
    "id",
    "version",
    "kind",
    "status",
    "requires",
    "conflicts",
    "rules",
    "commands",
    "checks",
    "capabilities",
    "riskControls"
  ],
  "properties": {
    "schemaVersion": {
      "const": "1.0.0"
    },
    "id": {
      "type": "string",
      "pattern": "^[a-z0-9-]+/[a-z0-9-]+$"
    },
    "version": {
      "type": "string",
      "pattern": "^[0-9]+\\.[0-9]+\\.[0-9]+$"
    },
    "kind": {
      "enum": [
        "runtime",
        "package-manager",
        "language",
        "framework",
        "test",
        "quality",
        "ci",
        "deployment",
        "observability"
      ]
    },
    "status": {
      "enum": [
        "stable",
        "experimental",
        "deprecated"
      ]
    },
    "requires": {
      "type": "array",
      "uniqueItems": true,
      "items": {
        "type": "string"
      }
    },
    "conflicts": {
      "type": "array",
      "uniqueItems": true,
      "items": {
        "type": "string"
      }
    },
    "rules": {
      "type": "array",
      "uniqueItems": true,
      "items": {
        "type": "string"
      }
    },
    "commands": {
      "type": "object",
      "additionalProperties": {
        "type": "string",
        "minLength": 1
      }
    },
    "checks": {
      "type": "array",
      "uniqueItems": true,
      "items": {
        "type": "string"
      }
    },
    "capabilities": {
      "type": "array",
      "uniqueItems": true,
      "items": {
        "type": "string"
      }
    },
    "riskControls": {
      "type": "array",
      "uniqueItems": true,
      "items": {
        "type": "string"
      }
    },
    "optionalPaths": {
      "type": "array",
      "uniqueItems": true,
      "items": {
        "type": "string",
        "minLength": 1
      }
    },
    "optionalWorkflows": {
      "type": "array",
      "uniqueItems": true,
      "items": {
        "type": "string",
        "minLength": 1
      }
    },
    "optionalRuleSources": {
      "type": "array",
      "uniqueItems": true,
      "items": {
        "type": "string",
        "minLength": 1
      }
    }
  },
  "additionalProperties": false
}
