{
  "schemaVersion": "1.0.0",
  "id": "ci/github-actions",
  "version": "1.0.0",
  "kind": "ci",
  "status": "stable",
  "requires": [],
  "conflicts": [],
  "rules": [],
  "commands": {},
  "checks": [],
  "capabilities": [
    "ci"
  ],
  "riskControls": [
    "least-privilege",
    "sha-pin-external-reusable-workflows"
  ]
}
